### ISSUE TITLE
500 error when trying to push to hg/uwsgi

### ISSUE THREAD

**Issue by danielniccoli** [cherokee/webserver#874]
_Original author: nriley (October 05, 2011 03:58:28)_

I get a 500 error from Cherokee in the middle of a multi-hundred-KB POST to a Mercurial server behind uWSGI.  It doesn't always happen at the same time, but it never succeeds.

The POST looks like this:

POST /LMI/MPMS?cmd=unbundle HTTP/1.1
Accept-Encoding: identity
content-length: 1362267
vary: X-HgArg-1
accept: application/mercurial-0.1
user-agent: mercurial/proto-1.0
host: [...]
x-hgarg-1: heads=686173686564+a38b7005c6fa1ba0ea49378f10bc06bb4a8cda5f
content-type: application/mercurial-0.1

And from Mercurial, I see:

% hg push -v --debug http://[...]/LMI/MPMS
[...]
sending unbundle command
sending 1362267 bytes
sending: 64/2660 kb (2.41%)
sending: 128/2660 kb (4.81%)
sending: 192/2660 kb (7.22%)
[500 error]

Sometimes it makes it as far as 50% before failing.

It definitely seems Cherokee is returning the 500 without even waiting for the POST to be completed:

992.539588 172.17.203.67 -&gt; 10.251.79.12 TCP http &gt; 61308 [ACK] Seq=1 Ack=118119 Win=58048 Len=0 TSV=264880343 TSER=324114887
992.548748 10.251.79.12 -&gt; 172.17.203.67 TCP [TCP segment of a reassembled PDU]
992.548760 10.251.79.12 -&gt; 172.17.203.67 TCP [TCP segment of a reassembled PDU]
992.548766 172.17.203.67 -&gt; 10.251.79.12 TCP http &gt; 61308 [ACK] Seq=1 Ack=120827 Win=63040 Len=0 TSV=264880346 TSER=324114887
992.549144 10.251.79.12 -&gt; 172.17.203.67 TCP [TCP segment of a reassembled PDU]
992.549153 172.17.203.67 -&gt; 10.251.79.12 TCP http &gt; 61308 [ACK] Seq=1 Ack=122181 Win=67008 Len=0 TSV=264880346 TSER=324114887
992.549166 10.251.79.12 -&gt; 172.17.203.67 TCP [TCP segment of a reassembled PDU]
992.549171 172.17.203.67 -&gt; 10.251.79.12 TCP http &gt; 61308 [ACK] Seq=1 Ack=123535 Win=69888 Len=0 TSV=264880346 TSER=324114887
992.549188 10.251.79.12 -&gt; 172.17.203.67 TCP [TCP segment of a reassembled PDU]
992.549198 172.17.203.67 -&gt; 10.251.79.12 TCP http &gt; 61308 [ACK] Seq=1 Ack=124889 Win=72832 Len=0 TSV=264880346 TSER=324114887
992.549304 10.251.79.12 -&gt; 172.17.203.67 TCP [TCP segment of a reassembled PDU]
992.549310 172.17.203.67 -&gt; 10.251.79.12 TCP http &gt; 61308 [ACK] Seq=1 Ack=126243 Win=75712 Len=0 TSV=264880346 TSER=324114887
992.549323 172.17.203.67 -&gt; 10.251.79.12 TCP [TCP segment of a reassembled PDU]
992.549338 172.17.203.67 -&gt; 10.251.79.12 HTTP HTTP/1.1 500 Internal Server Error  (text/html)
992.549474 10.251.79.12 -&gt; 172.17.203.67 TCP [TCP segment of a reassembled PDU]
992.549488 172.17.203.67 -&gt; 10.251.79.12 TCP http &gt; 61308 [RST] Seq=1 Win=0 Len=0
992.549648 10.251.79.12 -&gt; 172.17.203.67 TCP [TCP segment of a reassembled PDU]
992.549658 172.17.203.67 -&gt; 10.251.79.12 TCP http &gt; 61308 [RST] Seq=1 Win=0 Len=0

This happened with Cherokee 1.2.2 and 1.2.99 and several versions of uWSGI - you can see this thread on the uWSGI mailing list where I posted some more info:

http://article.gmane.org/gmane.comp.python.wsgi.uwsgi.general/1830

http://article.gmane.org/gmane.comp.python.wsgi.uwsgi.general/1843

There is nothing printed to the Cherokee or uWSGI error logs.  I have tried disabling keep-alive and switching from epoll to poll (select won't work thanks to issue 858) but neither makes any difference.

_Original issue: http://code.google.com/p/cherokee/issues/detail?id=1276_
